{
  "$schema": "https://json-schema.org/draft/2020-12/schema",
  "$id": "https://github.com/karvashish/hardline/pkg/profile/profile",
  "$ref": "#/$defs/Profile",
  "$defs": {
    "OSInfo": {
      "properties": {
        "family": {
          "type": "string",
          "pattern": "^[a-z][a-z0-9._-]*$"
        },
        "version": {
          "type": "string",
          "pattern": "^[0-9]+(\\.[0-9]+)*$"
        },
        "variant": {
          "type": "string"
        }
      },
      "additionalProperties": false,
      "type": "object",
      "required": [
        "family",
        "version",
        "variant"
      ]
    },
    "Profile": {
      "properties": {
        "id": {
          "type": "string",
          "pattern": "^[A-Za-z0-9][A-Za-z0-9._-]*$"
        },
        "display_name": {
          "type": "string"
        },
        "version": {
          "type": "string"
        },
        "os": {
          "$ref": "#/$defs/OSInfo"
        },
        "profile_schema": {
          "type": "integer",
          "default": 1
        },
        "min_hardline": {
          "type": "string"
        },
        "actions": {
          "items": {
            "type": "string",
            "pattern": "^(?:[A-Za-z0-9_-][A-Za-z0-9._-]*|[.][A-Za-z0-9_-][A-Za-z0-9._-]*|[.][.][A-Za-z0-9._-]+)(?:/(?:[A-Za-z0-9_-][A-Za-z0-9._-]*|[.][A-Za-z0-9_-][A-Za-z0-9._-]*|[.][.][A-Za-z0-9._-]+))*$"
          },
          "type": "array"
        },
        "templates": {
          "items": {
            "type": "string",
            "pattern": "^(?:[A-Za-z0-9_-][A-Za-z0-9._-]*|[.][A-Za-z0-9_-][A-Za-z0-9._-]*|[.][.][A-Za-z0-9._-]+)(?:/(?:[A-Za-z0-9_-][A-Za-z0-9._-]*|[.][A-Za-z0-9_-][A-Za-z0-9._-]*|[.][.][A-Za-z0-9._-]+))*$"
          },
          "type": "array"
        },
        "allowed_overrides": {
          "items": {
            "type": "string",
            "pattern": "^[a-z][a-z0-9_]*$"
          },
          "type": "array"
        }
      },
      "additionalProperties": false,
      "type": "object",
      "required": [
        "id",
        "display_name",
        "version",
        "os",
        "profile_schema",
        "min_hardline",
        "actions",
        "templates"
      ]
    }
  }
}
