{
  "id": "itest-package-rollback",
  "display_name": "Integration Test Package Rollback",
  "version": "1.0.0",
  "os": {
    "family": "ubuntu",
    "version": "24.04",
    "variant": "lts"
  },
  "profile_schema": 1,
  "min_hardline": "0.0.1",
  "actions": [
    "actions/10-package-rollback.json"
  ],
  "templates": [
    "templates/10-managed.conf.tmpl"
  ],
  "allowed_overrides": []
}
