{
  "id": "starter-secure-ubuntu-24.04-lts",
  "display_name": "Starter Secure Ubuntu 24.04 LTS",
  "version": "1.0.0",

  "os": {
    "family": "ubuntu",
    "version": "24.04",
    "variant": "lts"
  },

  "profile_schema": 1,
  "min_hardline": "0.0.1",
  
  "actions": [
    "actions/00-packages.json",
    "actions/10-ssh.json",
    "actions/15-unattended-upgrades.json",
    "actions/20-sysctl.json",
    "actions/25-timesync.json",
    "actions/30-firewall.json",
    "actions/35-fail2ban.json",
    "actions/40-audit.json",
    "actions/50-journald.json"
  ],
  "templates": [
    "templates/15-unattended-upgrades.tmpl",
    "templates/40-audit-hardening-rules.tmpl",
    "templates/35-fail2ban-ssh-protection.tmpl",
    "templates/50-journald-hardening.conf.tmpl",
    "templates/10-ssh-sshd-config.tmpl",
    "templates/20-sysctl-hardening.conf.tmpl"
  ],
  "allowed_overrides": [
    "allow_tcp_ports",
    "allow_udp_ports"
  ]
}
