{
  "id": "itest-multi-plugin-force-rollback",
  "display_name": "Integration Test Multi Plugin Force Rollback",
  "version": "1.0.0",
  "os": {
    "family": "ubuntu",
    "version": "24.04",
    "variant": "lts"
  },
  "profile_schema": 1,
  "min_hardline": "0.0.1",
  "actions": [
    "actions/10-multi.json"
  ],
  "templates": [
    "templates/10-managed.conf.tmpl",
    "templates/20-firewall-template.tmpl",
    "templates/30-ssh-invalid.tmpl"
  ]
}
