{
  "id": "hardline-demo",
  "display_name": "Hardline Demo",
  "version": "1.0.0",

  "os": {
    "family": "ubuntu",
    "version": "24.04",
    "variant": "lts"
  },

  "profile_schema": 1,
  "min_hardline": "0.0.1",

  "actions": [
    "actions/10-ssh.json",
    "actions/20-firewall.json"
  ],
  "templates": [],
  "allowed_overrides": []
}
