{
  "id": "itest-ssh-reload-success",
  "display_name": "Integration Test SSH Reload Success",
  "version": "1.0.0",
  "os": {
    "family": "ubuntu",
    "version": "24.04",
    "variant": "lts"
  },
  "profile_schema": 1,
  "min_hardline": "0.0.1",
  "actions": [
    "actions/10-ssh.json"
  ],
  "templates": [
    "templates/10-ssh-sshd-config.tmpl"
  ]
}
